business_name,review_id,rating,text,time_created
The Pommelers Rest,Zsutwq1BIZXJnhXpeA6_cw,4,Great spot not far from the Bridge that is mostly frequented by locals.  Solid draft beer selection and the bottle list is pretty good as well.  Reasonably...,2019-03-06 09:38:50
Chez Antoinette Covent-Garden,q9XTyAJUUx1-rlU3rDq6Zg,5,This was by far the best place we've eaten while in London!  Highly recommend! Nice staff and great food!,2022-12-31 04:42:43
Chez Antoinette Covent-Garden,G6-q3yV29g6uWvpA3lMhNQ,4,Charcuterie meats and cheese platter 7.65/10- absolutely loved the prosciutto and duck confit as well as the different cheeses. The salami was a bit hard...,2022-07-22 09:52:12
Chez Antoinette Covent-Garden,E828LBhonhy0s5QQI7Vfdw,5,Made my morning perfect! I was just visiting the garden area and stumbled upon this gem down the stairs near the market. I had never heard of it prior but...,2021-11-29 18:52:26
Bao Borough,Rb9ziBqS91B2y4h9cTJa7Q,4,"Before my trip to London, this resto was on my food to eat research list. Coming from Vancouver, Canada, I'm spoiled with 5 star Chinese food. With a little...",2022-11-10 16:44:03
Bao Borough,kJwQM9VGjf48EJ-17A_JJA,4,"With the intense line, we decided to order takeaway for a couple of baos. Takeaway still took almost 20 minutes. The baos we ordered were both good -...",2022-12-28 15:48:07
Bao Borough,7oRZTzpQQekmAz_34pQfdQ,5,This place was amazing! I was visiting London from New York and knew I had to visit Bao at Borough hall! We went up to the window to order and then decided...,2022-11-22 17:25:38
Poncho 8,fOgRnxYlxK7l8qa18P-5mw,4,As far as lunchtime burritos go you could definitely do a lot worse than this place. I went for the chicken option although they had the usual selection of...,2015-07-30 08:09:32
Poncho 8,BzFbizI6WDUfHGgJFWeMTQ,5,PonchoNo8 have constantly been filling my inbox with their deals (which are indeed welcome) but the location is just far enough from work I'm unable to go...,2013-08-07 13:04:46
Poncho 8,olOJ3y-rM66p_rj5LWYHjA,4,"I came here because I was dying for burritos.  Was in the Spitalfields area and decided to try something new.  I came here at 3pm on a Monday, and not...",2014-09-23 05:34:17
The Parcel Yard,dkcki5VAc9pw9JGKdyDU8g,5,We were being super tourists and naturally were visiting Platform 9 3/4 when we decided to try the pub at the top of the stairs. The menu had fish and chips...,2018-01-08 16:14:20
The Parcel Yard,h_Tw76oU47Rc5ycj4B8-Xg,3,"Okay, this is a classic railway station pub, namely because it is actually located inside of the railway station (which is something that doesn't seem to be...",2022-12-21 01:51:20
The Parcel Yard,SnkUScYp8PJaMTdFjs_55Q,5,The tomato soup was one of the best I've had. Very delicious along with toast. My husband ordered the chicken Schnitzer with mashed potatoes which I tried...,2019-07-06 06:17:34
F. Cooke,48-KnvnT5JW0JVI8VJ0igg,5,"Very tasty pie and mash, the meat and liquor being particularly good. 
Sadly not many of the young hipsters wandering around the market seemed interested....",2011-12-06 14:59:40
F. Cooke,ujnAko1VELidZtO3DAt14Q,2,"If you saw F Cooke featured on a YouTube video and your interest was piqued, I will tell you that the food is simply not that tasty. I got the jellied eels...",2021-01-04 16:33:15
F. Cooke,tg1Emib2Jx6wf7zVG-SCCw,5,First time eating pie and mash. The eel licorice and jelly where surprisingly good. Joe (the owner) and his wife where great hosts. Highly recommended for a...,2018-11-11 06:22:23
Barrio Shoreditch,dxf1H7AU9OMZ9_79h0hmwA,4,"This was my first time checking out the London night scene. It did not disappoint. Although the name of the place is deceiving, the don't play a whole lot...",2018-10-30 12:13:21
Barrio Shoreditch,JhNi4qBFlyeX5PtdKSDHRA,3,"Note: from my Nov. '17 vacation. 
The Tapas bar is located in the Shoreditch region of London, the happy ""amigo"" hour was offered M-F 4-8pm.  Brightly...",2018-01-25 13:51:22
Barrio Shoreditch,eFxU0OaXFf0jsVRix8dJKQ,3,"Lasts night I was saying goodbye to a friend. She had her leaving do @ Barrio. It was my first time here and I would come back.

They have amazing selection...",2016-04-27 03:18:54
The Roebuck,HcS28V7hKr2qDR4ddI6KNw,5,"I love this pub.
Drinks are very reasonably priced, the pours are great in their cocktails too. 
The decor is lovely, very typical london pub( which I...",2016-12-14 12:46:58
The Roebuck,qUveZKXsOZH0zOyTJujReQ,4,"I had such a pleasant time at The Roebuck. Right off the Borough stop on the Northern Line, this pub provides cheap beer, great food, and a homey...",2017-05-21 11:32:42
The Roebuck,xK-kbAre87S2A2W3q4h4UA,5,"One of the best pubs with its own wonderful atmosphere! 
You can get a range of standard beers (no craft beer), but overall ambience is delightful! Would...",2017-04-20 12:41:10
Chi Noodle,F_5l2Y1NBtFME064-xXRxQ,5,"In a word, awesome! I had the gyoza and Singapore noodles. And when I asked for it spicy, they did it properly by cooking addnl chilies into the food and...",2022-12-19 04:30:02
Chi Noodle,fu7ij8Kr1is5hgQusjHEKQ,3,"Chi noodle is in central London, so a convenient location with numerous noodle (and rice options). We ordered family style to share. The stirred fried lamb...",2022-06-30 15:28:44
Chi Noodle,rDLj7aueTc9dTJH6kb7nLw,3,"IMPORTANT: 12.5% service charge

Came here with my family. We ordered noodle soup, fried squid and dumplings. 

The dumplings and fried squid were quite...",2020-01-03 07:37:00
Pizza Pilgrims,-dxmaFOvsZQNlm_JHFWcww,5,This place is phenomenal. Truly the best pizza I have ever had. Definitely give it a try,2022-10-14 10:22:13
Pizza Pilgrims,3mIB2wdWqzIeO2csNZ_ABA,4,"I just love Pizza Pilgrims and have made it my mission to visit as many of their branches as possible - better get a move on, there are quite a few...",2018-12-11 04:27:58
Pizza Pilgrims,-f7KlHfaD_NXlp4RKyTX8Q,5,"Well well well, this was a pleasant surprise! 
Let's talk about my experience here: 
- a very nice and helpful waitress, always attentive but not...",2018-12-10 07:16:32
Rossopomodoro Covent Garden,GqdBF-1BOwJfVn99lU1FRA,5,"We've eaten at Rossopomodoro's before in Venice and Los Angeles and had great experiences there as well. 
However this time we came pretty jet lagged and...",2022-07-12 09:03:33
Rossopomodoro Covent Garden,t9qOCasSEFcKZl2TtAIy_g,1,"Not good.  Not only did I see the food sitting getting cold, I watched a waitress with her hand put the ham on the pizza after was waiting.  
She then gave...",2022-11-27 08:50:44
Rossopomodoro Covent Garden,I2xVbtqNqxkl10NHRGiL1A,4,"Came her to experience Italian food. The restaurant is located along a sharp corner in Soho with incredible views. Great ambiance, friendly staff, large...",2022-06-10 13:03:39
Pizza Express,12BCrYVY0xrkE5OnWwzC5w,5,Anyone who knows Pizza Express knows it's not particularly incredible (especially being from New York!). However it does hit the spot if you're in the mood...,2019-04-02 02:06:23
Pizza Express,phcKCnAXav8hAlkrzrVX6w,3,"Basic food nothing unusual. More like comfort italian pizza. Not recommended to keep going there but if you are new in town, you can try its pizza. Pretty...",2021-07-20 20:27:48
Pizza Express,Im4KI26efAKy6O2t6yE52A,5,I have to say. We haven't been happy with the food in UK but we came to Pizza Express just to grab a little something to eat. The food was the best we have...,2022-02-28 10:06:40
Mudmee,Z-mbpu-JDf5o9xGGoyv95w,4,"One of few reasonably priced places in this part of town. You can get a meat main course all in, inclusive of service charge for £10. Menu is a little bit...",2022-07-27 13:51:31
Mudmee,moWn8dJ_pJE3cS11kjlVEA,4,"Solid food, nice decor, friendly staff and very reasonable prices. 
Spice level can be a hit or miss, but easy to adjust with the spice tray. We got prawn...",2022-09-24 13:53:18
Mudmee,r1fxo0lanjrpKTF3KajOqw,5,Great food. A bit cramped space wise and bustling. Great authentic Thai & Malay food.,2022-09-02 08:36:50
Capeesh,AMvhxVT7odzU6Gc4VrYKaw,3,"Take this review with a pinch of salt because we visited during the holiday period.

So, I made a booking over a week ago. Arrived 5mins prior with my crew...",2019-12-19 10:02:27
Capeesh,ZZ-ZYgeJUjSaJfRnS8aIBw,5,Was in London recently with my family and stayed in Canary Wharf area. There were not many great restaurants but this one stood out. Everything we had was...,2022-06-29 17:28:42
Capeesh,FlagW7DAcPbyY-fcGueHxA,3,"Really 3.5, but it was not good enough in my opinion to warrant going to 4. First, the place is like a long and expansive hall, with nothing really breaking...",2018-07-29 10:24:47
Burro E Salvia Pastificio,tuDU0xryoFE0nqs7yVDHxw,4,"I bought a portion of Tortelloni Spinach and Ricotta for take-away which were rally good, with a tasty and fresh filling. Packaging is great as well. It is...",2020-05-23 09:50:58
Burro E Salvia Pastificio,E0k6wMD8dYYUsRC5fZsaVg,4,"Wowsers. When I heard this place did good pasta they were not wrong. Upon seeing it listed, I immediately ordered the Black Squid Ink ravioli from the...",2015-10-12 04:51:28
Burro E Salvia Pastificio,FBRl2pVVm4p2gAkmfa9QSw,4,"This place is slightly out of the way to get to in Shoreditch, but worth making the trek to get the freshest pasta. It's certainly faster and cheaper than...",2017-12-06 02:53:58
Eastern Eye Balti House,efLeYxoRQUlUB9hd7WUAsQ,4,"I stumbled across Eastern Eye while wandering through Brick Lane trying to decide where to eat. The sign in the door offering a starter, main, side and naan...",2015-08-24 08:38:27
Eastern Eye Balti House,ebI2Ck6Elq6qLkMAAsLRRg,5,Great authentic Indian food. They have wonderful hospitality and are quite attentive. There is also a large variety of options available to choose from.,2022-06-20 12:26:33
Eastern Eye Balti House,0iZOWjAMJ7u76Cr9zpGmQw,5,Excellent Indian and great service! Are here four years ago and am doing so again tonight!,2022-06-20 11:25:52
Roast Hog,B_gmhywkJrWiUBjZwUgChA,5,"You could hear everybody's mouth crackling! I buy my roast hog on their small store inside Borough Market, they don't have the yelp place yet so I will put...",2017-07-28 06:59:47
Roast Hog,bNfgx51LFSUzcDRuf_U_dQ,3,"3.5

£6 for a massive sandwich with this sweet purée sauce, greens, and a hunk of pork. 

I recommend the wrap just because the huge ciabatta bread was just...",2018-07-08 13:07:19
Roast Hog,Cl84FxMzWYfRM7y6aEe-MA,5,AMAZING!! I shared with my boyfriend but I could have easily eaten one whole gigantic sandwich by myself. We got one pork sandwich at borough market and ate...,2016-11-09 09:16:47
Well and Bucket,v4mNIt-XejBXOPbmisTTtw,5,"Great bar in the heart of East London, been back in London for a few days and already been here twice.

Food is great as is the selection of drinks.

Staff...",2018-03-30 05:00:55
Well and Bucket,A7L8QqJ6pDUkZDunjY1QyQ,5,"Head downstairs to the cocktail lounge next to the bathrooms. This little speakeasy is a gem. 

Upstairs is a charming pub. We happened upon it after not...",2020-02-13 05:47:29
Well and Bucket,xShUkk-9h5Pe1KTGYV4v-g,4,"Must be owned by youngs or some chain but decent beer selection, clean loos, bad sliders, good antiquey vibe albeit verging on soulless. 

Can't say that...",2017-12-29 03:58:53
The Spice Of Life,PFEJRj5tjmQ5EaZqDZJ4ew,5,"Great little place right next to the Palace Theater.  Drinks and dinner were great as was the service and atmosphere!   

It starts really hopping before...",2022-08-08 13:22:24
The Spice Of Life,p_sFbFwfO50A2ODw_TdwTQ,4,I can't even count how many times I've walked by this place and brushed it off as touristy.  It couldn't be more centrally located in a spot that screams...,2022-02-24 12:23:08
The Spice Of Life,sCoQVzuVkJGq-HqeOaXsmw,2,Came here twice with my boyfriend looking for some live music. The place looked well kept and seemed to be a popular spot for music lovers/bar goers. The...,2022-03-14 16:53:39
Tap Coffee,KbOIELdqM9rvPWEJZeeQCQ,4,"Great cafe with fire of natural lighting. They play a nice assortment of music, so you're able to study as well as catch up with friends. 

The cold brew...",2016-06-11 06:13:38
Tap Coffee,5Q-rVE6fxSPQk23CcIhmhg,3,I've been coming here for five years now but my last visit was underwhelming. The coffee does not display the same amount of care they used to apply. My...,2019-10-27 23:25:04
Tap Coffee,DW0E5yNUbpAVxPACPJDtOQ,5,This place serves the best coffee in London. Their mocha is great. They have large selection of pastries if you make it before noon. They don't have WiFi...,2019-06-13 04:29:45
Porteña,z2dLy1TSDzgP6Y71RD5yjA,5,I love Borough Market! There are so many different types of food stalls to choose from! My family and I are especially drawn to Porteña for their...,2020-01-29 14:25:44
Porteña,yxb952q60VMTA4THKLdncw,5,"Delicious! The perfect soft ciabatta bread, yummy grilled steak! Would come back to  Borough Market just to eat the steak sandwich! Perfectly simple sandwich.",2022-06-14 05:56:44
Porteña,mY5joVlhMyzmmFxeOvUApQ,5,"Woo babyyy!!! These empanadas are BOMBSY! I totes wished that I could have gone back to get more of them while I was in London, but I'm grateful that I...",2019-06-20 11:09:01
Franco Manca,Cyvv0TnlyYVceMWj4ffkXA,4,"I really enjoyed Franco Manca for the delicious pizza, good service, and inexpensive prices. The pizza had a great mixture of being thin on bottom, but with...",2016-06-03 17:27:08
Franco Manca,ASAA8ERaQXzUyKhLrq_pAw,4,I had high expectations for Franco Manca since I'd been hearing about it since I first lived in London in 2012. They had the one location in Brixton back...,2016-02-03 03:28:56
Franco Manca,AX2QoKIvs3EMXBomQ9TbiQ,3,"Possibly the best value artisan pizza in London ...  no wonder people are queuing down the road.
 
I like a pizzaria with a limited menu but the option to...",2016-06-25 11:36:50
Bierschenke,BOKk9yaAyVQWtsbwDx9G9Q,4,"Completely empty in the evening, which may be circumstantial. Long tables and benches, serving staff in German outfits. Service was a bit lacklustre. I...",2020-03-17 01:14:22
Bierschenke,AKFY6nEliGk3253g7f1_VA,3,"The place has an amazing pub vibe on a Friday night. Beers and service are both amazing, the chicken schnitzel was alright. A little dry for my taste. The...",2021-10-18 01:21:34
Bierschenke,EjThGi4W68kc6vSxuhJr2w,3,It's cool. The schnitzel can be skipped here and all music and videos are in German so that's authentic as well. I'd say come here for happy hour and with a...,2019-02-20 23:11:22
Omnino,LiMhzMmkPIMnfcF_U6KsGw,5,Boyfriend and I visited London in November for his birthday and decided to try this place out and I must say this place was by far the best restaurant we've...,2019-03-06 17:16:28
Omnino,BGw-7Jkiz75201RKYhi74w,5,"Great selection of steaks and sides, really friendly front of house team and a good selection of very reasonably priced wines. What's not to like!",2019-10-26 06:58:10
Omnino,wtBe7YPRMCO-cVSjFtLpNQ,4,Service was excellent. Steaks were great. We had the set menu and were very happy. We were also very full. Would certainly recommend.,2018-09-14 13:34:27
Maida Indian & Indo-Chinese Eatery,zh7Wc6vOcgjTYXe3Fh5ApA,4,"Ever since the BBC2 'The Kitchen' show that featured a family making Indian-Chinese food, I've been looking for something like this. First time I have seen...",2014-11-28 06:13:15
Maida Indian & Indo-Chinese Eatery,9GzxmpFywMsPFOjV5f7nag,4,"Ordered via seamless for delivery to my hotel, I got hot and sour soup with chicken tikka masala, delivery was faster than estimated time and food is...",2017-05-16 13:54:27
Maida Indian & Indo-Chinese Eatery,lmIAkds5tPFzovwmU_UF4w,4,"Maida manages to fill a long held need for me: good curry, delivered.

""Medium spice"" for these guys is no joke, so if you like your curries sinus clearing...",2012-02-16 16:03:08
The Punch Tavern,GKA3jgaAu_S_r-XhegVhpw,5,"This place was extremely nice, the staff was amazing. Definitely recommend for people to try.",2022-10-24 13:05:35
The Punch Tavern,k_vZPODDRtSoohWkoLO9RQ,5,"Fish & chips enough said. That's what I came for. That's what I left happy about. Well, I also think the drinks and classic and beautiful pub atmosphere...",2022-08-10 12:58:37
The Punch Tavern,qnYDT51r8zdps-MntwbhmA,4,Great atmosphere with good selection of beer. Service was good for a pub setting and they had lots of knowledge around beer and gin.,2022-11-24 11:54:24
Eat Tokyo,lcOcabTP9S7zHjMzvs3m8g,5,"There's always a long line outside of this shop and once you try it, it makes sense why. This Japanese restaurant offers a ton of Japanese dishes in huge...",2022-12-16 22:18:15
Eat Tokyo,PGjaNArXqJnMuu1kReKLPQ,4,I saw a lot of people on YouTube come here and it's definitely worth a try if you're in London. Plan a head because it is a popular spot so there will a...,2022-12-04 13:03:17
Eat Tokyo,iVLlGUHqAF8-jntWvpylYQ,4,"Seriously for the chicken wings alone I'd have given it 5 stars, let alone everything else was also perfect.

My only complaint is that it can be way too...",2019-10-11 12:27:46
Suchard Restaurant,z2J4WlAVEdeq7yBPH_ZSnQ,4,"Went here with a friend to grab a bite to eat for dinner on a weeknight. I was expecting it to be more crowded based on the reviews, but we were able to be...",2018-03-07 17:16:50
Suchard Restaurant,97_4sY7WIddT_GS9zPpdMw,3,"Ordered several starters between us, which came on a fancy platter that looked good and fit on the table much better than a bunch of individual dishes. I...",2015-08-18 23:57:37
Suchard Restaurant,Gl-WTmuUmdYHunZ5mjceSQ,5,"Love, love, love, this place! You don't have to make a reservation and everything was superb! We ordered two imperial appetizer plates with chicken satay,...",2017-07-03 15:07:47
The Jolly Butchers,CFdKj8SPTzachK30AwwFMA,5,"This pub is really good for a proper Sunday roast but even better than their roast is their pork belly. Tender, juicy, crispy and perfect for a late lunch...",2016-01-10 03:26:21
The Jolly Butchers,Gd1z-AEaarIo1ShLE0QiiA,4,"I decided to come by here on my recent whirlwind 3 night trip to London in December, just because they had a vegetarian (and, sometimes) vegan option for...",2017-03-04 09:08:01
The Jolly Butchers,vSTWUrkwB7fQEbHj9mtugA,3,"Another food on my British bucket list was a Sunday roast, but most places that offered this were charging exorbitant prices. I found this place after...",2017-05-27 08:51:28
Café Brood,Vv_iwGCscK5SfQlxPNJu5w,4,Brood is a family run restaurant that is part of the Borough Market complex. Brood mainly serves typical Mediterranean dishes and will leave you amazed by...,2021-02-05 13:30:55
Café Brood,iyWMYsAKLbCKhBLF9cTRcw,3,This is the first food stall as you enter the Borough Market from the London Bridge. The food has a varied menu and a bar. It also has tables and chairs...,2022-08-22 16:25:49
Café Brood,MDYQ-sCahXgWF5ZEwYBuPg,4,"Cafe Brood, on the edge of Borough Market, looked like a good place to grab a late lunch. Like most places in the market, you could see the food being...",2018-10-20 14:58:30
Portrait Restaurant,um2LMYPZhnUABR7fU51DdA,4,"I'm teetering between 3 and 4 stars.

The location, as everyone says, is amazing. We got seated right by the window, so we had an amazing view of Big Ben,...",2017-06-25 09:28:33
Portrait Restaurant,5Xq1maV2ekhoo2CJjrAS5w,5,Great view! The NPG has been reconfigured such that where the new stuff once was is now a for-pay exhibition. We were just popping in to see what was new....,2019-05-13 21:34:04
Portrait Restaurant,o2Fk-x1HKjsG2ws5ZRrIfw,2,Came here for afternoon tea with champagne which ended up costing us around $140. Wouldn't have minded the price had the service been better. Our original...,2020-01-18 20:40:55
Bella Italia,HnZS7M5-kGaoVT-qDxYtpg,5,"On our second day in London, my friend and I really wanted some good Italian food. We found it at Bella Italia, a little place at the end of a row of...",2023-02-04 13:04:46
Bella Italia,dKT0XhUPlhNraH_R13mOFA,4,"Came in here at 3pm and was seated right away. It was an off hour between lunch and dinner; we were running in California time!

Actual Italian waitress was...",2022-05-11 17:16:59
Bella Italia,kXb1_axid4qzguJUopKH8g,5,The holidays can be a busy time in London.  On a busy night in Leicester Square we popped into Bella Italia and we're surprised to be seated right away....,2022-12-23 06:18:19
Silka Borough Market,Hghk20DejIAl1yLPdViQ8w,5,"Hands down the best indian food I've had. It's a textbook hole in the wall because of it's location, literally an underground restaurant. The chicken tikka...",2022-10-17 15:29:33
Silka Borough Market,meajGqjrALsFKgB-KCKfIQ,5,"One of the best Indian restaurants in London. 
The starters were great 
The main course was delicious 
It would've been better if they had dessert.",2021-10-09 06:52:07
Silka Borough Market,LCIYKz0RBANQzwt3tkMbgA,5,"Service was great, the waiters made me feel welcomed! The tikka masala was perfectly cooked! Naan was hot and crispy. I highly recommend!",2022-06-18 14:02:14
Persepolis,LnlDV5l2Yf-4dNryIXyBHA,5,Wonderful food and an absolutely amazing experience.  I actually happened to meet Sally and Jamie on one of their rare days off away from Persepolis.  Over...,2017-10-02 10:58:54
Persepolis,jPyy0pYlmmd1CKrlrV9ERw,4,"Still my fave veg restaurant, for the tasty food, the huge portion sizes and cheap prices. Yes, you should make a reservation and you'll likely still have...",2019-03-07 11:26:51
Persepolis,DxqgGgBNojcjQ5yW1WH2sA,5,"A very eclectic and interesting Persian cafe/shop that serves lovely middle eastern vegetarian food, ingredients, books and supplies.
Very busy when we...",2017-10-01 10:19:14
Covent Garden Grind,UEVw7khXTzlMUG5buHGE_g,5,"Great spot, really nice and welcoming staff. Maria was a delight serving us. 

Food was great. I had the asparagus and eggs, my wife had the smashed avocado...",2019-09-11 01:15:22
Covent Garden Grind,n2DyJ8C2SEaPuMPLtqBYHA,2,Disappointed. Came here for a coffee and breakfast snack based on the reviews and the great photos of the food to find that all they had were 3 kinds of pastry!,2022-06-27 02:50:36
Covent Garden Grind,Y2VPIQgFri8KHukQzZzsbw,5,"The food is delicious and the place is really nice, highly recommend! Lattes and croissants are spectacular",2022-02-20 08:49:09
Leon - Bankside,fWpljiWN3hBnCLBX_2haQA,5,"I stopped by here after my visit to the Tate museum. It's located conveniently right across the street from the Tate when you exit.

I absolutely loved the...",2018-07-26 16:30:25
Leon - Bankside,Gq7SgCp1sQz98VQ-18ZKGA,5,Loved it! First time here and best fresh fast food ever! Wish there where fresh fast food places like this in the states,2022-06-24 07:54:49
Leon - Bankside,iQ5sOA6rLnJ4HxgAobExdA,4,Leon is at the healthy end of the fast food scale with branches all over London. They are part of the government backed 'eat out help out' which means you...,2020-08-04 05:13:06
Bread & Butter,hQJrt7ovpDWyytuJOcj3SQ,5,"I LOVE this place! From the outside it may not look so awe-inspiring, but in my opinion it is one of the nicest cafes around this area. Open from 7am-7pm,...",2015-04-06 11:08:01
Bread & Butter,CfYJvw6T75y-S_Aq211K6w,5,"Third time at this place, so I thought I'd leave a review! Today was my first time having lunch here, though. I went with a grilled chicken wrap,...",2019-05-24 08:17:48
Bread & Butter,1BlGgaRUQIXt6qMjFvs_OQ,3,"I was early for a meeting near Haggerston station and spotted this set back cafe across the road.

No excuse for another coffee on a busy day of meetings...",2016-03-02 03:26:41
Okan Okonomiyaki,znNfRQttxvPaFAdd585khQ,5,Unreal food and service. My friends and I were in the area and did not know where to eat. Saw this hole in the wall restaurant in a market and the food did...,2022-02-02 10:59:51
Okan Okonomiyaki,6xSLacgzUoaJjLbB4Mr4fA,5,Whoa! Great Japanese street food! So I totally fell in love with Brixton market today on our walk through - so many cool stores and hip places to check out...,2018-04-26 12:56:55
Okan Okonomiyaki,KxjLjRzcNx3ZXoWtDNXRXg,3,I never tried okonomiyaki before so this was cool to try! Tried some from my friend who ordered it. It tasted like an omelette with all types of vegetables...,2019-10-27 14:15:52
The Pembury Tavern,j2JMhg8WcmAlNFlilgo_jw,5,"Popped in here on an unusually hot day while towing my 20 Kg suitcase and had to take a call.  Here was a bright, clean/tidy nice pub - not full of blaring...",2016-07-21 09:49:32
The Pembury Tavern,4_b-QeHAQnVNqmKjaX4PYw,4,We happened upon this place after a bus ride to wherever we decided to stop. No Guinness but I am glad. The lager is amazing.,2019-04-19 06:28:26
The Pembury Tavern,aYK1mbHR4TlFXQSSJnQHEQ,5,"Wandered in looking for a quick beer and a bite to eat, ended up with a fantastic pizza and even better service from the staff. Friendly staff and fantastic...",2020-08-08 14:21:39
Chinwag,5F3yxq6iJwe6AZtTt5k4Ow,5,"Best Breakfast I had during my 2 week stay in Europe.  Hands down!  This place was fabulous and all you want in a breakfast establishment.  Small, quaint,...",2015-12-02 13:08:15
Chinwag,AgKm-pSv7lH7y_UplATlRA,4,"We have been meaning to go here for quite some time now and today we finally took the plunge. And I'm very glad we did. 

This is such a lovely and warming...",2016-10-01 13:56:35
Chinwag,Xg7zKEMx92BQk5eE5tyRwA,5,Love!! Adorable little place with fantastic coffee and breakfast. I loved my eggs Benedict. My friend  ordered a ridiculous specialized burger and the staff...,2018-09-11 11:01:20
The Ship,JMOJaJ31IeDXtSJfT8aGVA,5,Kinda a funky pub for a Friday night. I came here during pirate night and the place was dressed up like a pirate. Brings me back to the Yelp Key West Pillar...,2012-10-31 10:29:00
The Ship,mML5BKV0BVSJH1_iM7ngug,4,"This is a cool little pub. I was told this was a bit of a dive, but I've seen so much worse in my day. Compared to some dingy neighborhood bars I've been...",2018-12-07 04:29:24
