business_name,review_id,rating,text,time_created
Five Guys,61oa8PXMQYCbWVpNVHRRVw,4,I love 5 guys! It has been a while since enjoying the succulent burgers in the States! I don't think this particular joint met my romanticized expectations...,2017-03-10 14:49:41
Five Guys,N1aH0qQZQ7Z2CTjWtuHohQ,5,"Our go-to Five Guys in London. Kind and attentive staff, fries are always on point, burgers are done right. Some times I'll get the lettuce wrapped burger...",2022-05-08 10:57:39
Five Guys,Ud4sGi7lfPB1_KbM2ZqOng,2,"Service: Ok but it's little bit takes time to get food. 
Cleaness: Not good, on the tables and the floor are so messy. 
Atmosphere: Normal",2019-11-14 07:36:35
Southwark Tavern,6rXRzaBHJQ9fcwjoL2wpgQ,5,"A great place for a Sunday roast!!  The beef was perfectly cooked, roasted veggies were spot on delicious and topped off with a beautiful Yorkshire pudding....",2022-08-22 05:24:32
Southwark Tavern,vagBvNBZcOhCMazALVeFzw,5,"This tavern was great for us.  So close to Borough Market, but not overrun.  Secondly, it was authentic British, but not too authentic.  Food was good,...",2022-06-17 13:15:51
Southwark Tavern,jwgGY0HwAvUcqlsTTJcR6A,3,"Inside very warm n cozy pub feel 
Clean and lots of different types of seating. They also have a downstairs seating area

Customer service good, typical for...",2019-11-14 11:21:40
Le Garrick,xJZsKIt7Bj77BxRnWXLY3w,5,Atmosphere: this quaint French bistro is tucked on a side street off of Trafalgar Square. They have a ton of seating with a basement area. The hostess took...,2022-08-28 06:57:30
Le Garrick,9EeHyoeOR3eoasQ5Gq9rig,5,I went here for my 26h birthday in London and it was wonderfully cozy and warm food that made me feel fuzzy inside. The flavor was all there. Excellent...,2022-09-21 17:29:48
Le Garrick,W5EfDWjF51JUwm76T72k0Q,4,Authentic French restaurant in the center of London.. the food and service is good..nice ambience too,2022-10-29 08:38:49
Nando's,b50DUTtNEtBXr1GESW6hhg,5,Peri Peri chicken is what this place is known for.  It's a South African chain that specializes in a Portuguese style chicken with African bird's eye chili....,2017-12-02 11:01:12
Nando's,F4yN6Odltl7q09lO6TJuFQ,1,"This Nando's is located in Mile End, East London, with it being the nearest store with delivery to Canary Wharf, I ordered from here to my hotel, Lincoln...",2019-05-19 13:27:19
Nando's,5hbuYseFAftR4EOpuh4Mkw,4,"Never met a Nando's that I didn't like. Visited them first in Africa while on vacation then in America and Canada.

This location is pretty similar to all...",2017-11-28 07:21:43
El Ganso,8MiBCAjh63uQz6MkxbCjyg,5,"I didn't want to do anymore Yelping because i recently decided not to give away my intellectual property for someone else's financial gain, but I had such a...",2014-10-14 13:43:31
El Ganso,p8J0TJlpQZ0Q8mVUY11YWw,5,Rustic style restaurant with amazing food. The tapas is nice and has flavour. Their breakfast menu is also really nice and is my go-to when I want a...,2020-08-15 12:10:01
El Ganso,K_UZIONLmFrY1LRg3Dk9TA,4,"Nice little cafe, doing takeaway right now.  Has some nice substantive plates as well as pastries and cakes.",2020-04-07 15:57:24
Cafe Pacifico,SDmxzp9GfGAK3IC-iXxi_w,5,"I love the margaritas there!
Very comfy and smooth place!

You can choose from a nice menu and the staff is always in a good mood",2015-09-20 04:14:25
Cafe Pacifico,tcOi4tAZYGL1ulazv2G0-w,5,This is Allison I am 11 years old and this restaurant was AMAZING!!!! The food was Great and so was the service! I had the Chicken fajitas and were so GOOD...,2022-05-22 11:22:03
Cafe Pacifico,_dcz2rcFP728HLhdYj5dGQ,5,"Our family visited this restaurant about three times while in Europe.   Our first visit was random, our second and third were not!  They have delicious...",2021-09-25 11:24:37
Le Relais de Venise,XaXWWIXaYumC05qt7Gi8ZQ,5,Le Relais de Venise was one of my favorite places in Paris so I was SOO happy to see they had a restaurant in London! We came around lunch time on a weekday...,2022-12-30 08:14:01
Le Relais de Venise,YHOwELYDVZJ0XG-vcEFC0A,2,Totally overhyped food... Quality for the price isn't worth it. You get at most about 6oz of mediocre steak. The sauce was bland and needed salt and pepper....,2023-01-13 15:51:58
Le Relais de Venise,vCl441hJvwEVJClW2T-GTA,4,There's something comforting to know that simplicity can deliver beautifully. Your choices tonight? The same as it is on every table in the restaurant....,2017-08-27 12:23:58
Salaam Namaste,ueFI4ATDLUeccFYn7NEYHg,5,"Great food. Great people. Had Samosas, Chicken ""lollipops"" and Chicken tiki masala. All terrific. Great prices. Naan was delicious as well.",2022-09-11 09:12:13
Salaam Namaste,8vfWOL89QQxUOrhEJSzODQ,5,"London, right? I can't remember. But I want to keep this review when I'm back there so I know where to go and can finish this. Geez. Sometimes life happens.",2020-11-15 16:19:48
Salaam Namaste,X0i8iqoZ330FYBlPpJ9LDw,5,First meal in London on Christmas evening. Was searching high and low for a place open late. Went to one restaurant across town and found out they only had...,2019-01-20 12:09:28
Kanada-Ya,4wFZadTqYtHgS1t4xLYVOw,5,"Usually when I go to a new city, I want to try as much as possible. I went here TWICE in my 3 week stay in London - that's how awesome this place is!
My...",2020-01-18 12:05:18
Kanada-Ya,E4ZM9yIK2KYlSFjOcZqRvQ,4,Last time we came to Kanada Ya was 3 years ago. The ramen is just as good as we remembered and worth the 30-40min wait. Surprised there was a wait even at...,2022-12-31 07:07:08
Kanada-Ya,Oib_xgAi_MA4VBS66pc2kw,4,"I tried the Tonkatsu X and thought adding some chicken to the broth made it taste a little lighter without diluting the flavor.  The noodles, pork, etc....",2022-12-09 12:41:01
Moro Restaurant,35p3qR9kIUu_2o1T-_JBGw,5,"Moro is a simple yet elegant delight. On a stand-out pedestrian street in Clerkenwell, Moro focuses on Spanish/Morocco food to good success. On a weekday...",2019-07-30 05:39:08
Moro Restaurant,bjUz5KQySFub1rJbOipH_w,2,"When we visited for lunch, we were not impressed by the flavors and quality of the food - while the service was good, we didn't particularly love any of our...",2022-08-16 07:37:02
Moro Restaurant,cOnKA4JQSE9mdLrkrgrrcQ,3,"This place came highly recommended. But after an experience with their current Christmas menu, I was less than amazed. The flavors are fused together, and...",2022-12-05 03:14:59
Siam Central,c_tojoq8Fq521fI12Ax9AQ,5,"Rocked up by pure Chance & what a find! 
Wasn't sure if we could get a table,but upon entry was greeted with two smiles & a ""Hi,sure come in""
Clearly people...",2022-10-20 03:47:24
Siam Central,pMfzHIzxPVKK6lm5MLguYQ,4,"Came here on a weekend evening, had both indoor and outdoor seating. We were seated downstairs which was really spacious. I got the Tom yum noodle soup with...",2022-09-08 23:12:29
Siam Central,ftOoEJwjeSOYJnmoWRJ6UA,4,Siam Central is a casual and comfortable Thai restaurant along charming Charlotte Street in Fitzrovia. Here you can get tasty curries and stir fries with...,2021-12-18 12:35:43
Rasa N16,KvVExHMvGEFK_mo7FSErjw,5,"I've been excited try Rasa, the original and vegetarian only location, since I've moved and it did not disappoint! We squeezed in before the 10:45pm closing...",2016-05-31 04:57:19
Rasa N16,uWw9UuYWSZcyoMXlSAxWIg,4,"I arrived here last Sunday night and was very pleased with the array of veg options, especially veg options I don't find on other Indian menus. I opted for...",2017-06-27 12:51:17
Rasa N16,lKi2ZVipr6kokRvNn42OPA,4,"Had dinner here last night. Food was delicious, amazing value and different to the usual indian fare available. We had starters, mains, sides and nibbles...",2016-10-06 03:02:30
Kirvem Restaurant,LdiFPkwcqXDNUhbbBDQ1BA,5,this Turkish restaurant!!! My favorite main dish is the chicken wings plate. I LOVE the honeycomb candy that comes with the tea. So wish I knew where to buy...,2022-03-15 13:15:23
Kirvem Restaurant,lLYDPKwfBZODCCIMWg51JA,4,"Yelp 100 Challenge 2018 - # 66/100

What a lovely restaurant within walking distance of Limehouse train station and our hotel. Atmosphere was relaxed....",2018-10-14 14:27:40
Kirvem Restaurant,tc4qQ_ixZple_15Xu3CNDA,5,The service and food were awesome. Definitely different from the English food but it was great and will be coming back soon.,2020-03-16 01:50:49
Chicken Shop,RN0TEcQAqz23lsmREWhyhA,5,"Wow. So we are here in London and honestly we had been so disappointed in so many of the food places...  until now. Mind you, we've been here a week...",2019-07-04 05:34:47
Chicken Shop,DjeyXXjhdtnjrIXcq4P2Lg,5,John at chicken Shop knotting hill area is the best. Best service received in the five days we've been here! True asset to the company. He deserves many...,2022-07-03 07:47:35
Chicken Shop,DR87saynbNtdJF0pzlmVeg,5,For those new to London (like myself)... please do not get mad if you walk right past this spot.  I walked past it 2-3 times.  It is definitely a more...,2019-03-22 15:01:45
Hurwundeki,AnO2Ytx2deETrukgwcRt6A,4,"I like the bare bones aesthetic of this place. Really focused on the food and company. Also, it is BYOB! Huzzah!

I had the bulgogi, which was tasty but I...",2016-05-22 00:23:47
Hurwundeki,0dG9QeyuZFaIbOiiWXNn_g,5,Amazing cut and colour from the director Ki! lovely coffee and conversations during the appointment. had taken my mum there - who was also very pleased with...,2021-05-07 06:55:11
Hurwundeki,wYOb052P1BuF85qRisAoow,4,"I had a really excellent beef bulgogi with a side of kimchi. The kimchi was sour and spicy and delicious, and the bulgogi came sizzling. It was fantastic....",2015-11-05 13:45:52
Hoxton Square Bar & Kitchen,YsSUtttkPVt4kEw869ktIA,5,"Relaxed atmosphere. REALLY strong drinks. Friendly staff. They had hip hop karaoke going on in their club area, which is why I went to Hoxton. 

Ordered a...",2017-05-11 20:43:06
Hoxton Square Bar & Kitchen,k_CpCML_ZeiQ5RQL5Mz1kw,4,"Lots of exposed concrete give this pub a rather utilitarian feel, but their full bar and intimate space would make it a great place for a late night hang...",2011-03-04 08:31:14
Hoxton Square Bar & Kitchen,trxGDPYQjkyayN25eEgj-Q,3,"Not a bad little bar but not the best - to be fair it's probably more of a 3.5 in my book! 

Fairly large, fairly clubby - it would be perfect if you have...",2016-06-16 01:29:30
Bloomsbury Coffee House,mHeamMYetmfQDYIVaLAqFQ,5,"All during my trip throughout the United Kingdom, my lady and I stayed in guest houses that included breakfast.  And, of course, most of them were the Full...",2016-03-22 09:03:59
Bloomsbury Coffee House,GSaiNiBRL6yAGUdaueZRsg,1,They were closed with a Christmas tree blocking their door.  Not sure if it was a holiday type of thing or that it has closed permanently.,2022-12-13 14:35:02
Bloomsbury Coffee House,KTbjWa-u6Um8VJG-3GraTg,3,"I came here on a Sunday morning, about 8:30 am. The place was about 40% full at that time. My first impression was that the cafe was small and the low...",2019-03-03 05:12:28
49 Cafe,hv3E7vJZ2K1-1nofvmI_Hg,5,"Great spot for a quick breakfast or lunch. We stayed at a hotel nearby during a recent vacation.  Inexpensive and cooked to order, this was our ""go to"" spot...",2022-10-13 23:41:28
49 Cafe,B7OOKNqNT3iibxi7PecNRg,4,"Easily a 4 stars. Convenient cheap and love the speedy service. The sandwiches are just great, the pasta man everything here is just amazing totally...",2021-08-12 15:30:24
49 Cafe,zqLbSS2O2OpDsVqF6gXF8Q,5,"Excellent food and hospitable.
Nice, small and quaint neighborhood spot that makes you feel like a local.
Prices were reasonable.",2019-09-27 10:46:21
Pie Crust Cafe,8klAAxoiRJ2VE9RIn2svfg,3,"Food taste is acceptable, but not exceptional.
Rice portions are somewhat small, my main dish was ok, but I wish they would use boneless chicken thigh meat...",2019-03-20 07:21:43
Pie Crust Cafe,TQkE0AWaKbwuIlCXRnxyXw,5,"This restaurant only have two types of food one is amazing and the other one is super amazing! 
You have to try the coconut milk soup as my friend said it...",2015-12-04 12:47:06
Pie Crust Cafe,hQdv_ZXBHvimpl-1kvU5kg,4,A reliable local Thai option when I can't be bothered to walk to Rosa's in the shopping center.  I've been a few times with a few different friends and have...,2016-11-04 15:13:34
Leila's Shop,jCH09EZkVJMIownDNUY-eg,4,"Leila's shop is both a shop and a small restaurant next door.  And both are just beautiful, making the most of the stunning old building they are located...",2015-11-25 01:08:55
Leila's Shop,xG4zF3OckTe3_spIf5MrNQ,4,"Stumbled upon this gem while wandering the streets of shoreditch. It felt as if I got to go back in time. It was so magical, that I didn't mind they didn't...",2016-12-07 13:58:23
Leila's Shop,g4sHSZk0orBslXWfG8t3-g,5,"Cutest little cafe with a communal table, excellent coffee and teas, and perfect egg custard tartlets. I love the fresh fruit plates with ripe stone fruit,...",2016-06-18 11:55:10
The Market Porter,zxyh9wpihMoepHWVR-RK5g,4,"Downstairs a 3* but upstairs for food a 4*.

Went here for drinks then decided to get dinner.  Getting drinks at first was a bit of a mission, they had the...",2019-12-29 09:51:11
The Market Porter,53Ai9lXY5gOgrsMmz__gPA,1,I recently had the misfortune of visiting this pub and was greatly disturbed by the manner in which I was treated by one of the bouncer. I was subjected to...,2023-02-04 11:08:47
The Market Porter,Yd3xhF5CNmq6MjtIiNXVRg,4,"I stopped by here to get a drink before dinner as I had time until dinner reservation.

Typical British pub ambiance, located at the Borough market, not a...",2019-07-08 12:19:57
The Ivy City Garden,x4R4GWlSxFSWYuu0bvJj6g,5,"Amazing place!  The decor is charming, the service is top notch and most importantly, the food is absolutely delicious!  We, a party of 4, enjoyed our...",2023-01-17 04:40:56
The Ivy City Garden,Uua-uazvv0G3qLQEiZ-mJg,4,"A cute environment for all occasional. Lots of options on the menu to eat and list of fun cocktails to try should you chose. 

A tropical decor makes it...",2022-12-07 16:58:41
The Ivy City Garden,ZxBfSMV9vM2BfStvPFzX4g,4,I came here for breakfast and really enjoyed their food. It is very popular and they have a very nice interior with flowers around the restaurant that makes...,2022-06-26 20:44:31
Vanilla Black,bGNq8BP_599XAIfelx5oBA,5,Myself (omnivore) and my wife and daughter (both vegetarian) were visiting London for a weekend and after a long day enjoying all that London has to offer...,2018-07-21 15:09:57
Vanilla Black,2EYPi-FPXg8nLRncHmIsKg,4,"Vanilla Black offers a fancy, inventive vegan-friendly tasting menu that was largely delicious. 

As you can see from my photos, we tried a few things, but...",2018-11-02 10:53:47
Vanilla Black,WCROvPvXv7Cil17jwuoQDQ,4,"Come at lunch to take advantage of their very well priced prix fixe menu. We had two courses plus a bottle of wine and it all came to £80. Great value!

The...",2019-02-24 01:18:07
My Place Soho,JzK3WOu61iPaiMAxy3URfg,5,"Delightful. Wonderful food, healthy or not depending on your preferences. Friendly service and a cozy atmosphere that is clearly a neighborhood gem....",2019-04-12 23:38:35
My Place Soho,HulI-XZWhEGuqi6ktGc9cA,5,This is the place to go for an English breakfast - always packed from morning to night which attests it's popularity. We had their breaks fast with black...,2022-05-31 14:58:59
My Place Soho,ROmUjsaZGEnWlcYLL_XEWw,4,In search of a cafe we stumbled across this nice one and sat down at a table in the back. The variety of cakes and pastry looked quite appealing and so we...,2019-04-03 13:24:07
The Parlour,KxrIwrermOBLVzuWyf_IsQ,3,"Came here for a Sunday brunch with a friend at around noon - restaurant was reasonably packed but service was a bit slow 
That being said - the actual food...",2016-10-20 04:07:46
The Parlour,FzDhjA1tydE1pNSrFX25pA,3,"This is a meet me after work for a quick drink or two spot.

Mind you, I've been here a few times and everytime is the same - nothing earth shattering.

The...",2013-11-13 05:34:27
The Parlour,PomR0t1lWfQ3tdbL6PIabA,4,"They serve excellent bloody mary's...one of the best in London. 
Ohh...the food is also very good and not too pricey.",2016-02-08 10:51:09
Canto Corvino,WI0ksmiSgvk3PQ3cRtL3eA,5,"Great Italian food, lovely decor and brilliant service. Highly recommended. A good selection of wine.",2022-08-09 13:51:37
Canto Corvino,o6ylrvJaEQOn3ZTx2AwBPg,5,"Stumbled upon Canto Corvino while walking through London with a colleague on a Thursday night. Amazingly, we instantly got a table at 7:30 pm. We split an...",2018-11-09 19:01:16
Canto Corvino,vxIdtwJfBl2oWn3DKhrPJQ,3,"With a name meaning Song of the Raven and its twinkling, beckoning lights, Canto Corvino should be a stand out in the little gastro nook that is...",2018-12-25 19:25:44
Wagamama,btGCTwVjjVLXiP2S_Hx9iQ,5,Incredible setting and environment and service was quick and efficient. They forgot our waters twice tho. Food was affordable and delicious big in portion....,2022-10-18 07:17:36
Wagamama,l6EzpXrPbaL6VT2GgQNV2A,5,"Just as great as I remembered....this was our 1st food stop visiting London and it was perfect.  We were sat immediately, food was served quickly, and we...",2022-03-17 10:08:20
Wagamama,WrZIhE8IxeZ9MeTgoUXE4A,4,A great selection of good that hits the spot. Service is always friendly and the seating arrangements can seat a family very easily.,2022-12-23 21:49:39
The Eagle,-w5l_t1Ase3G7RiZ3XlzzA,5,"Another bucket list pub that lived up to expectations!  Good great, DNA ale great, staff great!  We accidentally sat at the table where the DNA discovery...",2022-11-17 16:16:46
The Eagle,lA1KFnsqqTLKK6aNRNCx-w,4,"If you're looking for a quiet pub with a warm fire and leather coverage seats, this place is not for you. It is very crowded loud during the lunchtime rush...",2022-12-02 09:41:10
The Eagle,-49zKh6QSpaCZucHqPuaDw,5,A very friendly pub with a nice interior and exterior. A very historic venue which is also very popular.,2022-04-18 02:00:06
Indiana,stPOy-brqgRGBY8RGkoM-w,5,"Really nice food had it a few times from here and it's consistently good, service is nice and friendly and not a long waiting time till food is ready
Thumbs...",2020-11-14 12:19:21
Indiana,pFVfNxuJvI67iFVW3qIWWw,5,"so, I have been to this restaurant many times now, and the experience and customer service have always been outstanding. I would greatly recommend the...",2016-03-17 07:08:15
Indiana,ABh_Ix9fC3qUA5gKQzUZ7g,5,"I recently visited London with my family, and we found Indiana by accident when we discovered the place we tried to go didn't serve food on Sundays. We...",2014-12-19 21:14:09
Paolina's Thai Cafe,-NQn38JrPH8_aOWLdzgslQ,5,"We love Paolina's! We have ordered takeout multiple times while staying in Kings Cross. Great pad Thai, green curry, steamed dumplings, Tom Yum soup! Oh my!...",2022-09-15 03:05:07
Paolina's Thai Cafe,TLf2ypCiMY62Pa5F4OrAvQ,5,Paolina's is a charming local Thai Cafe great for a hole-in-the-wall dine-in experience. There's a small room in the back with a couple tables for an...,2021-08-05 06:38:39
Paolina's Thai Cafe,4Yb51VhvYNYtZoj4eV5CDQ,5,"Wow its amazing...
Delicious dinner! The inside of the pub is really cool, lots to look at. It's really popular so you can expect a wait. For dinner we...",2022-06-17 08:02:52
Hej Coffee,VCxfpgzjN7igc-5pw9u2Fg,5,Lovely little place to grab some Java and stare into the eyes of someone you care about. Food was both healthy and delicious. Child friendly.,2022-10-31 08:34:54
Hej Coffee,G3FmR-oYivM4F72F9pzQaw,4,"This has become one of my go to coffee spots for whenever I'm in Bermondsey. It has a really cosy and homey atmosphere, and is perfect for getting work...",2019-08-03 15:17:44
Hej Coffee,T_qy4AkP7ohHThg96iecxQ,5,"My go to coffee hang - I would say every Sunday but literally any day of the week I can spare I'll head here!

Soya latte is the best I've found yet in...",2016-06-16 08:48:41
Tamarind Kitchen,atrx7XNccuspohtVZyWM5w,5,"What a treat! 

Mango & Avocado chaat was a great start. Light & fresh.

Slow cooked lamb & butter chicken had the best spices. Garlic & cheese naan is a...",2022-11-27 05:37:36
Tamarind Kitchen,UkEuU3LpDWD4u0SgKBXLyQ,4,"Love this place. May I strongly suggest you get the slow cooked lamb shank?! It just falls off the bone and so tender. You will not regret it. 

Also the...",2023-01-20 15:16:46
Tamarind Kitchen,9UFz4iaEQikFd24QmDOlDA,4,"My husband and I chanced upon this and Yelpers just confirmed it. 
Amazing! This place transformed me from a non-Indian food eater to one! I never liked...",2022-11-10 16:28:43
Wawa,_uCYQTcniVb7Ys7OXeWgoA,5,"Absolutely amazing! Not one to write a review often but where one is needed one is given. Not only was the food out of this world, the staff was so friendly...",2016-02-09 07:03:58
Wawa,B5lUiti2rsCuNytjG3BkaQ,4,"We went to Wawa on Monday at 7:30 and it wasn't crowded, but I have heard it gets crowded on weekends during dinner, therefore I would recommend going on a...",2019-08-05 13:51:52
Wawa,3xzusUA4ZiN0jlVmrIekkw,5,Yummy Japanese food/ramen. It was just a 5-min walk from our place and I loved the look and feel of the place. Very modern and industrial but really...,2017-06-28 13:11:08
Fire & Stone,Q5nYvIRjx9ObLGSHSziYLA,4,"Very nice place! Found it while strolling around Covent Garden. 
Pizza is great, and they'll start to serve burgers as well. 
They gave us the new burger...",2017-06-30 11:47:12
Fire & Stone,p-_SfcVQUXznBEYfs8a5qA,3,"I love the world themed pizza toppings, I felt the ingredients matched their cities very well. Being from Melbourne, I order it. I have to say it was very...",2017-05-04 09:35:04
Fire & Stone,3-spLeO_9SRhgOrwqOsq1Q,3,"The sleek, modern architectural style of Fire & Stone would leave one to believe the food is comparably polished, but unfortunately it's not. Also, I have...",2019-12-05 03:33:30
Gallipoli Again,KeHkn5xNthuSYrXZ9JxMRw,5,Great food and ambiance! We loved it! The vibe and service was on point and the food was delicious!,2022-10-31 08:29:29
Gallipoli Again,6dizzBS9fX6SJbOuCQu4xg,5,"If you read my reviews, you'll know I do t give out 5 stars very easily, but Gallipoli again has earned it!!

Last night our group of 17 attended for a...",2015-01-11 10:32:31
Gallipoli Again,Av_YKdVSCs4XnH9Os7zZKw,5,Delicious!  Wonderful!  Fresh!  Eclectic!  Love the food and the decor. Service is friendly and efficient. A must do in Islington.,2016-11-24 06:02:21
The White Hart,EI_ec9p7y9JrrR_ggfe5QA,4,"The White Hart Brew Pub is my favourite spot in Whitechapel for a good beer. Renovated at the end of 2014, it is now a clean, contemporary space with a...",2016-06-22 06:00:19
The White Hart,DjZJuuvtf3axEHWzPeR3zg,3,Walk with me .... to a pub off the tourist track with an interesting history. Considering it is in Jack the Ripper territory and a few hundred feet from The...,2016-02-11 05:11:34
The White Hart,igxhj0YUY9DICgtphxgSTw,4,"This place rarely fails to disappoint. The fish and chips are spectacular, the English breakfast phenomenal, the burgers amazing. Don't even get me started...",2015-09-04 05:21:50
Satyrio,vsIOhWnNnIv3Nn23xbqdaQ,5,My husband & I came here for dinner one night while on our honeymoon & really feel like this is such a hidden gem! My husband found the restaurant & on the...,2022-07-25 13:18:13
Satyrio,dyvFqkwPW6JkheogGridbA,4,Loved the vibes in this restaurant very cute and feels luxury. Pretty expensive and the menu is a bit limited I think they've taken some things off I still...,2021-11-14 05:38:26
Satyrio,1JW8su5pLTqIcYy6tbLCEA,5,"This restaurant gave us a superb dinner tonight
Service was wonderful and the main course that was the 
house specialty. We've spent 5 weeks traveling...",2019-10-31 14:43:31
Indian City,iZgWvAL_cf8Lfhj6P7uGBw,5,"Wonderful food. The best Indian Food I have ever had in London. 
The service and ambience was also superb. Highly recommend!

Truly great evening.",2022-10-01 13:37:42
Indian City,0-li2hYRfDCvNAj6BQRnbw,2,"It was insanely crowded upstairs, so thankfully we were able to get a table downstairs in a secluded corner. COVID protocols don't seem to be a thing in...",2021-10-25 13:17:55
Indian City,re6h_e2Ulo7SjvJRlCsv3A,5,Just finished a great meal with terrific service! I love Indian food and was looking forward to picking a cool restaurant in London. The mixed appetizer was...,2022-07-09 12:57:46
Nando's,lnxPb2nHlPEIMsuTe6TE4A,4,"For a chain in London, the high ceilings and domed windows overlooking the Thames river was still impressive. If you're looking for flavor in London, don't...",2022-06-10 15:30:47
Nando's,-FwsGB6RTPkejDAkrjzTdw,3,"This place got a lot of hype from all the Americans who told me to try it out, but I think I had too high of expectations. The chicken was good, but nothing...",2022-03-29 17:33:05
Nando's,BjDqIRqRcVQLvL0KGGDWPQ,3,"As a first-timer, I found the ordering process was not self-explanatory. You first need to be assigned a table number. Then you order at the counter and...",2018-12-10 01:45:35
German Gymnasium,KE7gxtfurgzdPljUoMOEoA,5,"London food is notorious for not being *that* great. However, this was our Go-To restaurant while we stayed at the Standard hotel and we didn't know where...",2022-11-27 23:54:03
German Gymnasium,mL7ON5mjFARb5yRrXmrgog,4,"The food was good, but the service could have been better. I felt the waiters were not as attentive to us. We'd have to flag them down multiple times for...",2022-11-19 13:56:47
German Gymnasium,PsXLsU6Cp88gnz58Rsb3PA,5,"This very large and open bar. Has quite a history. It's called German gymnasium, because it was built in 1865 for the German gymnastics society. And hosted...",2022-06-15 02:14:15
Bea's of Bloomsbury,XJw7di8hC8bwf9AxMGe2dA,4,"Bea's does a really good ""Bea's Cream Tea"" if you want a cheaper version of Afternoon / High Tea. 

It comes with two freshly baked scones (original or...",2019-05-01 09:16:56
