business_name,review_id,rating,text,time_created
brat,Ogx35Ji8qsQHD4tuhzq1Wg,4,Michelin-starred and with the top 100 best in the world fame:  Brat - restaurant named after the old English colloquialism for the flat fish - turbot....,2022-12-21 04:29:46
brat,KazI_sSZloMlk-Bhr8-AYQ,4,"We especially enjoyed the small plates and wanted to love the turbot, having seen it featured on a television program.  The turbot was good, but a tad dry...",2022-12-31 03:04:34
Hawksmoor,SPOKNBzMonoZ3ym2sbG3KA,5,They offer a variety of prime cuts on their menu. We ordered their Prime Ribs and I must say that they did not fail to deliver. The beef had an equal crust...,2023-02-21 11:00:35
Hawksmoor,gaLlKRfgD6iygYknnefaEw,4,"Nice dinner spot.  Old style steakhouse with lots of room and an old English pub feel.  Interesting decor.  Ok wine list.  

I had the beet starter.  Ash...",2022-12-14 21:19:29
Hawksmoor,pxhLB_XeER1kZd6MSI7RnQ,5,We stopped by Hawksmoor after a day of exploring London. The food was absolutely divine! We tried a number of dishes and everything was cooked and flavored...,2022-07-18 13:56:29
Darwin Brasserie,lDJEUEIClKXmVIqjF5vonQ,4,The Brasserie offers fine dinning with  spectacular views of London  perched high on the 36th floor of the Sky Garden.it's one of several eateries at the...,2023-02-13 17:47:49
Darwin Brasserie,7EcyXR9hpgyCsLOSiHOn6g,5,"The food is good, not great, but the view is six stars! Service was very attentive, friendly and accommodating. Pricing was ok, for what you got. Would...",2022-07-30 21:21:41
Darwin Brasserie,yLeYFT-SWG2OOBxS_HaaWA,5,This place was FABULOUS for breakfast. Just the views alone had me upon entry...then you add yummy pancakes and bacon for the kids and eggs Benedict with...,2022-07-05 10:31:35
Long White Cloud,BOwTmeyhvskyuN_sGrZQPA,5,This place kept me going during my time in London. I came in every day for 6 months and they were amazing! The staff is incredible and beyond friendly!...,2022-09-02 17:41:43
Long White Cloud,Rbbfh_0yMpfRsFvZaE3YdA,5,"Long White Cloud is wonderful! I stopped in a few times for breakfast while staying at a hotel nearby. The restaurant is really lovely inside, the folks...",2021-08-23 02:51:30
Long White Cloud,LOukTLt4hVD1mMiV9QkeoA,5,Cute little place with a delicious English breakfast. Staff is super sweet. Makes you feel warm and home-y. What a great surprise find! Great cappuccino  too!,2019-03-08 01:06:57
Mama Thai,UN3jYf1rzrqA1HnAGMSgDA,5,"I can't believe I haven't finished reviewing this spot. This is the place I will come back to every time when I'm in London.
Used to be my fav spot for...",2016-11-21 13:49:21
Mama Thai,79G0Cg29AdElQXsjjS2AwQ,5,I had the lamb curry with spinach. Very generous portions of great food for only £6. Smiley staff. It is a pity that it is open only for lunch and only on...,2017-08-08 12:35:14
Mama Thai,NeqdavbGJfIM_pnoXAes_A,5,This little mom and pop shop has been filling the bellies of hungry bankers and solicitors since it first began as a stall in the Spitalfields Market in the...,2015-08-02 19:56:42
Pizza Pilgrims,Cpe9rfnV9dHE1cOSJd1RQg,5,"I've tried all of their vegetarian menu and they're most certainly the best budget friendly pizza place in London.


They're quick, tasty and very friendly...",2022-07-17 12:53:02
Pizza Pilgrims,a-rXTKcKU4c_jIcavkvqgA,4,"Great spot for a quick meal!

We got a Vegan Pizz & Love and a Margherita pie to share between 4 people. The pizza was super light but a little on the bland...",2022-12-24 03:17:50
Pizza Pilgrims,4JgolPoZKrah6W6Ge1f3nw,3,"Service - good; very nice people
Taste -  so so (cheese was only partially spread ; crust is too soggy/empty
Atmosphere : ambience - casual /comfortable...",2022-08-23 18:00:03
Byron,MNz0DIwj2lFKY3PS3b1F4g,4,"What makes Byron great is not just the food, but the customer service. They spend time with each customer getting to know the table and really looking after...",2015-08-15 08:52:14
Byron,X5unMwgoXZHicf1657dxiA,3,"I just went in for a decent burger and a glass of rouge...looked around, pretty empty...never been to one of these places before and they are supposed to be...",2019-11-18 07:31:45
Byron,SgejOeiZnkqQYegI40kEog,3,"Was craving a burger and Byron called. I had see their sign from the DLR platform a number of time and decided it was time I gave it a try. 
The menu is...",2017-01-19 05:22:11
The Breakfast Club,w9TUddGMapw2-HRbqQ8vrg,4,Cute little spot! Opens early so went with a friend to get some breakfast for her birthday. I ordered blueberry pancakes and a caramel latte while she got...,2022-10-22 04:41:37
The Breakfast Club,1zEg9kMdugXZB5pyrMdAyw,3,Pretty busy spot. I sat at the bar because table service seemed impossible as a walk in. I didn't too much care for the bar but I wanted to eat right away....,2022-11-02 06:27:37
The Breakfast Club,7-xy5TUQISoJtTDqdC3xBw,5,The 80's flashback with music but i wish the decor was more reminiscent of the era and John Hughes movies. Great spot. Expect 30-60min wait time after 10am...,2022-07-02 08:16:58
Lobos Meat and Tapas,rKVwVH4YNgsVjlgb6g9_5w,5,"Delicious, waiters attentive and friendly, and super fun architectural vibes (restaurant carved out of arches of the train station).",2022-12-28 14:06:00
Lobos Meat and Tapas,3_cGD-j3j1kbH53HiRW0Cg,5,"Great tapas place in London ambient trendy great music and of course food is the best!
Don't miss it if you visit town.!",2022-10-21 07:41:40
Lobos Meat and Tapas,khPl_rzYwDRzPMYW35i6ZA,5,"We came, we dined, we drank wine, we gluttoned and more. This is pure food porn of the best kind. Marvelous, spectacular, hitting all the right...",2019-06-11 07:28:34
The Chandos,Je6zZ7LYKQIGTcF6pU5iRA,5,"Great pub near national gallery. Went in there alone and ended up not feeling alone! Great atmosphere, drinks and fish and chips !",2022-10-19 02:46:56
The Chandos,0GotdiMemeqzlaTzfkPY8A,4,"Great pub. I have been going there for years. Food is good. However, I spotted a mouse running under the booth while I was eating. It was a bit unnerving,...",2022-10-04 20:19:42
The Chandos,qiitJadC7Yv-askxnJ5r7g,4,"Wonderful employees. Great vibes in the place. Only had the fish and chips with calamari. The whole peppercorns on the calamari were a bit much, but...",2022-07-05 11:53:29
The Yellow House,yZn08vAQezsq09pOZsaeWg,5,"Absolutely delicious food - from hand-crafted freshly-prepared pizza (""Four Seasons"" is my favourite) to perfectly cooked lamb. Plus, an excellent selection...",2020-11-12 09:04:13
The Yellow House,6b64DVfeoZ3paVJAzzPSUA,5,"The Yellow House is genuinely one of those places that you struggle to criticise, I have eaten here many times including on Valentines day and I am yet to...",2015-01-06 12:45:35
The Yellow House,PDjVqIYoDt4mLdKYXQlEoQ,5,Wow! I found this gem by a flat that we had rented. Service was incredibly prompt and this was hands down the best burger I have ever had in my life. What...,2018-07-24 12:47:50
Roast,_rY9zXNonhLDxGYkA9DG7A,4,"This restaurant is so pretty and has a really lively atmosphere. Our service was okay, the server seemed pretty annoyed with us the entire time. The...",2023-01-03 16:00:48
Roast,UyT6cakee8YAdaDk48joMQ,1,My wife and I had dinner at Roast tonight. We were seated and then basically ignored for the next 15 minutes. A member of the wait staff finally stopped by...,2023-01-28 14:14:50
Roast,J6Ro1o-JUeyxDDtPI4UNwA,2,Checked in at 4PM on a Sunday for our reservation. The check in wait was too long for no apparent reason. We weee seated around 4:20PM. The restaurant has a...,2022-02-06 15:16:26
The Modern Pantry,-Xe4YGIDnicKzG45Y3QwLQ,5,Came here for breakfast during my solo trip in London and was very pleased with the service. I went at around 11 and was seated promptly. The interior is...,2019-10-15 14:20:24
The Modern Pantry,_Clyk-fIwlhqE_6htIrefw,5,"Loved this place so much!

We came on a Sunday morning right when it opened-- lucky for us, they had one table available  before the reservations started...",2019-06-27 14:58:45
The Modern Pantry,6Q2eaFEGyORUf0mln9LSag,3,"The Modern Pantry is one of the more well-known brunch spots in the city. This restaurant, located in Clerkenwell, has quite the pleasant ambiance - bright,...",2017-05-08 11:35:26
Yurt Cafe,Q6kk9HT3uEmO9F44Sp8QCQ,5,"Low key, relax cafe with awesome artwork for sale and generous brunch portions. I keep meaning to check out their live music on Fridays too. Might have to...",2021-11-08 09:05:07
Yurt Cafe,ACNsf71jW9MHcy1s0r7d8Q,5,"Awesome spot in London for chilling afternoon in an unusual place! The yurt itself is pretty big!

The decoration is nice and simple, very bright with cool...",2016-08-21 06:53:01
Yurt Cafe,e8fyeqCv94bTpk6Z6H63bQ,4,Nice place with good coffee and friendly staff. It is worth to check it out for the unusual ambient.,2019-08-18 06:34:39
Goodman City,Uj86UZAF-JgPHEdUpzYDLg,5,"Outstanding, we came here based on how close it was to a meeting that we just finished up.  they place was packed and we had no reservation. They...",2018-03-02 08:35:00
Goodman City,LdKlJdH95EaDo_8vHGzeZQ,5,"I would give it 4.5 stars but am rounding up. 

I ordered the mixed grill -- fillet with grilled prawns and lobster tail. Fillet was one of the best and...",2015-12-12 15:28:18
Goodman City,w4-TKLO9--FBabGzlHy_tA,5,"Aged to perfection and prepared by skilled chefs, their steak is perhaps the best steakhouse.Pamper yourself and visit Goodman for an unforgettable...",2018-02-06 08:31:43
Lyle's,IJwYERtPBFWdXpEoQH411w,4,"It was good but I had huge expectations and it did not work for me as much as I hoped. I had the luck to go to Brat and Clove Club the same week, and while...",2023-01-27 01:24:49
Lyle's,w_OqFVzj9O19G9a1-61nHw,5,Came by for dinner the other night and it was a world class experience. Definitely understand how this restaurant is listed as #33 on the World's Top 50...,2022-07-09 02:19:12
Lyle's,NuZfnjsQ65IPhh6K61vvfw,5,"Incredible. One of my favorite meals from our recent week-long trip to London. The menu and the pictures didn't jump out at me beforehand, but my wife...",2022-07-09 16:20:37
Coq D'Argent,woc-f40QbnnUcrVx3m2wGA,5,"If you feel the need to go to a proper restaurant with excellent food and service, this is the place to go. One of my all time favourite restaurants in London.",2022-12-18 04:33:52
Coq D'Argent,k0KqnbXkx41_3diA_ypYGA,5,"This place is awesome!  Great food, great service, great ambience and - best of all - great sommelier (Ricardo from Sardinia)! A must do when you're in...",2022-06-23 08:05:42
Coq D'Argent,qffnwVnua5nI0ipHgjMJQg,4,"Location, Location, Location. Coq D'Argent is another place you don't want to miss (locals and tourists alike). The views are fantastic and are hard to...",2018-11-08 18:01:35
Bubblewrap Waffle,nYPiLqL0OyY5SzjEIpPfbw,5,"One word to describe, FABULOUS! The waffles are wonderful, so is the ice cream. Lots of choices. As for me, chocolate waffle, hazel nut ice cream, Bueno...",2023-01-19 05:27:16
Bubblewrap Waffle,vAyzeLFBjfhtzQL9NIAJow,5,"What a unique dessert and quite a delight! The line was pretty long both times I went which is usually a good sign. It's a very small building, so basically...",2022-07-11 18:49:08
Bubblewrap Waffle,LunREN0we5gXBdtf8W7EXA,4,"I'm not a massive fan of waffles with a bunch of stuff in it. I just ordered the waffle as is, and it was delicious. Wait can be long - but they are fairly...",2022-09-24 16:25:25
Shake Shack Covent Garden,ZJ8mQQU1_mylPZl8AMrUpw,5,"Coming from NYC, this was still super tasty! After an evening of drinks, we went for a burger lunch. Ordered the shack burger with fries, and a fifty/fifty....",2022-05-23 10:17:55
Shake Shack Covent Garden,iS1aRi3nvnSG_J0bVT-eZA,3,Average chicken burger. Crispy and decently seasoned but a bit dry and the bun was soggy. Small for the price.,2023-01-01 12:14:37
Shake Shack Covent Garden,OBIGhxZIqpwsJcDLxk29hA,2,"If you've had Shake Shack in America, you'll be disappointed by this. The quality is pretty poor in comparison. The wait for food was at least 30 minutes...",2022-12-02 10:18:38
Pieminister,6AWCRT6ZWAOMrVBbBQajxw,5,"This place is SO. GOOD.
The owner is such a great conversationist while you wait for your pie, too. He was unfortunately closing early as we ordered, as he...",2019-10-27 09:41:42
Pieminister,UOup9ZZdnJeF6it4xViRaQ,4,Pretty tasty pie options at various locations! Vegan options are plentiful and there's everything from chicken pot pie to meat pies and vegan imitation...,2022-10-23 17:10:13
Pieminister,Glv7OzMF4p3IzWP6_uZYew,5,"Wow, Pieminister was the most affordable AND most delicious meal I had in London. I realize that it doesn't look the most appetizing, but don't let its...",2018-02-03 17:08:14
Boisdale of Canary Wharf,Zn8qbv_uB5hgI4OIz3XQ-A,4,"I hadn't been to a whisky bar before so when Parisian Friend asked where he could sample some of that juice, off to boisdale we went. 
Slap bang in the...",2016-02-07 00:11:32
Boisdale of Canary Wharf,E9DrtEe4wNZQbI5ErJypGA,4,"Tired of the casual hotel fare near the ExCel Convention Center in Dockside, we were looking for some fine dining and were intrigued after searching about...",2022-03-29 22:27:51
Boisdale of Canary Wharf,5zizpfs2YeSYjuio0zUAIA,3,Four of us came for dinner. It's like a cabaret dinner show type of venue which feels a little dated. Efficient service from the wait staff which was great....,2022-02-17 13:19:00
ICCo,5_5FeG4D2UltNEtSgdaOtA,5,"Excellent pizza place in Fitzrovia!! Two vegan pizzas on the menu which made us happy to see, especially in a non-upscale, low-key restaurant (even the...",2022-12-31 08:18:40
ICCo,AMjMQdfEe-zigk4IH3Q03A,2,Ordered a Margarita at around noon this saturday. Found a dead mosquito on one of the slices :(,2022-07-09 05:25:43
ICCo,aGVrW4M8-zhGENaCkRrPiA,3,"The oven pizzas are pretty basic and not burnt gladly. They need to be more crunchy though put them longer. But overall, they are okay and quite cheap...",2021-08-08 09:33:45
Hutong,t6SyuCIEhZvIAe8UF_kY0w,5,"This place is special in all ways. I thought it was just a hyped up place, but I just loved it. 

Chose this for a date night, and boy it was one of the...",2022-08-15 10:55:26
Hutong,3F2Z1BZyEWUbqzWCc2qNMA,4,A great overall experience at the Shard! My wife and I shared a wonderful evening with a fantastic view. We ordered from the a la carte menu (pictures...,2023-01-28 14:08:17
Hutong,vDWsbYkYnXVLjLQ7uMsVsQ,2,"The food was average. We were a party of 4, Service was mediocre at best, we waited quite some time for service. The menu was limited and I felt for the...",2023-01-16 13:38:14
Bento Bab,zPNpXyRnqbrl1EiaJ4cQiw,5,"Easy, fast and delicious store for your last minute rush for some solid food food near Aldgate East station. The food is a little sweeter and saltier than...",2022-12-28 07:45:24
Bento Bab,vfqUaTsIaLEd_hSLcFlTaQ,5,"On the second night in London, my gf from hs and I decided  to  check this cute Korean pub before exploring the city of London. To our surprise, we really...",2021-12-05 14:05:21
Bento Bab,VUMt_EuKVVLsCYRaXWi8gw,4,"While food itself was good, out of the five times I came to this restaurant, it was only open once on its provided hours.",2022-07-20 11:42:33
Nando's,mxNEnXGir3lpOtok270kRg,5,"Well it would seem the the whole world has fallen for Portuguese roasted chicken.

While Nando's is a chain which is just about everywhere offering great...",2019-03-12 11:23:25
Nando's,Mz77x9AqdTIvmc8VGLxrag,5,"No-one cheeky here...

Love me some Nandos on a working week night. Popped in here for dinner during a trip to London. Firstly the location is pretty handy...",2015-09-17 11:23:15
Nando's,LL0BxyMjGm_FIdqhtl75Sg,5,"I'm seriously so in love with Nandos!! Came here two days in a row so that's how you know it's real. 

Customer service was amazing. On the second day, some...",2016-10-14 02:13:04
The Jugged Hare,homB9tnI7Xqb1RnKjikxvw,4,Stopped in after an exhibit at the Barbican to treat us to a nice dinner and drinks. The pub has a hunting cabin feel with taxidermy animals all over the...,2018-11-05 14:38:44
The Jugged Hare,aYUvBpZqZpVBnw5MkOAVPw,4,"Is it a pub with a restaurant? Or a restaurant with a pub? The pub bit is consistently busy, from the lawyers and bankers in neighbouring buildings. I hear...",2019-06-14 11:39:20
The Jugged Hare,TCpJ6VcXw56u-u0Uuqq2Hg,2,"I've been twice in the past year.  I found the food to be quite bland on both occasions.  Starters, mains, and puddings. 

The service was also what I would...",2019-09-12 09:18:44
Lantana,sKSxhpoTBUXd3X1lIKDnVg,5,"At Lantana, you will find an awesome Aussie style brunch and I say this as an Aussie. Their brunch items are veggie-forward, filling and well-thought out....",2017-08-29 10:26:19
Lantana,cqti43J4Ib4f8HT2J2qtyw,4,Incredibly yummy Australian Brunch place. I shared a few items with my friend and we got the Lantana Blend Double Espresso shot with ice cream & toffee...,2019-03-28 03:43:52
Lantana,usW1sUtmZmyWje-owNfyIw,4,"Amazing food, decent drinks, and good service. Mid-range price. Its quite noisy inside otherwise it would been full score. Definitely worth going for brunch.",2019-08-25 05:00:56
Blixen,oNmeWtR9Pp3A3sKOLWWqvQ,5,"My daughter and I were staying nearby to Blixen in the Shoreditch area of London and stumbled on this gem of a restaurant.  The moment you walk in, you see...",2019-03-29 12:14:53
Blixen,wnfoP1Gonts6HTvT6vqU7Q,5,"Well shucks it's already been a year since my last review. Time flies when you eat good food ammiright??? Anyway, I've been back to Blixen a fair few times...",2017-08-27 14:24:42
Blixen,uVYAsHOHIcq9CJxi3Js9bg,3,"I went to Blixen for our NYE dinner.  Overall, it was a very good experience, with a caveat.  They had a reasonably priced 5 course menu - £45 per person....",2017-01-04 10:43:02
Royal Oak,ngmfvBwGiB-XNJDrymumjw,5,"WHOA.

Sunday Sunday SUNDAY!

I love Sunday Roast so much, I once made it for the premiere of The Walking Dead before. (A nod to its cast.) 

But mine...",2017-05-11 20:07:10
Royal Oak,NuHqkXF2Iipl_Tq9op7GNg,5,"Having been to London a number of times, I try to stay in this area as much as possible.  That said, I end up in this place more often than not and there is...",2017-01-06 08:28:52
Royal Oak,QGN3T0wRdwmYHcQuSJbAsA,4,"Ahhh, date night. I discovered this place on a date. It was the only good thing to come out of that night, and what a gem it is. I hope he doesn't read...",2011-01-20 09:43:05
Koya Soho,QirDO-85De0J5uY4HnWdGw,4,"We visited London for the week, and we saw this place pop up on so many people's recommended page. We were in the mood for some hot soupy udon since the...",2022-12-13 15:05:12
Koya Soho,6l_OPKIgiPuNgUSZa8Yiaw,3,"The rating depends on the baseline and maybe the items ordered. I've had lots of udon including several times in Japan, so maybe it maybe an unfair bar. For...",2022-12-10 11:47:04
Koya Soho,cS9K-bmP9hyoWv-oHBoiKA,3,"We went for brunch because I saw that Koya Soho is one of the best places in the area for brunch! We arrived soon after they opened, which was good. Seating...",2022-11-25 04:20:16
Scooter Caffè,JqFLlzVHegi8t9kMYwNUag,5,"Funky interior, but really good coffee. 
Perfect pick me up on a chilly Sunday morning. 
Serve beer and cocktails later in the day.",2019-12-08 03:29:26
Scooter Caffè,IHvP6AtfZPDdbk9kI9cxbw,4,"Yes, there is a lazy cat walking around, but the cafe is interesting enough by itself.
I love the casual ambiance, I think it attracts friendlier people....",2015-05-19 09:42:03
Scooter Caffè,hx4ukUrmiOV1ucbwZWfKOA,5,"Awesome spot for a drink at night or for hot chocolate in the morning. Great location, great prices, and a stellar barista named Ana. Will definitely keep...",2020-01-18 15:36:11
The Counting House,fOzC1RWoXA9dPALLLmMv5w,5,"Great drinks, great service! The ambiance is worth the visit! It just looks magical when you walk in! The food is outstanding! I'd you're in the area, drop...",2022-12-30 22:19:14
The Counting House,UDjwbH0WWHIXoQMZJmbBNg,4,"this is definitely a very nice find! It's got lots of Space inside. When we went, there was a way to book a meal at a fancy restaurant upstairs attached to...",2023-02-01 06:36:46
The Counting House,iHEbgvY3DljzYCMjk07ddQ,5,"We had the sampler and the fish and chips and it was ELITE.
Super great food and was my first time eating pies and I'm very happy it was here",2022-09-16 15:50:01
The Draft House,GRhytOcxj73QM0GNrecoCg,4,"Walked pass and stopped to grab lunch. It was packed, we  got burgers and fish and chips. The burger was good, the fish was not so good. Service was good,...",2019-10-06 09:00:18
The Draft House,7XAatTgTJ4mj2MlpQ4rQPg,3,"LOUD. OMG Loud. 
Saturday night. So fair enough. 
I walked in, then 5 minutes later, walked back out. 
Went for a short walk. Then walked back in. 
Fellow...",2020-02-01 13:23:13
The Draft House,Of_oNghZPWhvof5lwz41jA,1,"The first experience in London ended up being the most unpleasant and the worst experience in London. This experience was at The Draft House. 

We...",2019-08-17 08:06:33
Ngon Ngon,P-DWqvJk5Jx69vDKckkulA,5,This place has really good authentic Vietnamese food with authentic nc mm! The servers are great very attentive and patient with our orders! The pho is very...,2020-03-10 14:38:19
Ngon Ngon,nVkGThPGBRhbEjOcfWYQYA,4,"Soooo good, after a semi long traveling day this was my perfect comfort meal to eat.

The inside is big but feels very cozy, they have some seats that are...",2022-07-03 20:14:14
Ngon Ngon,EM5souQrDKSDjU50iOwPGQ,5,Great pho and other vermicelli dishes. The Vietnamese ice coffee is on point- very strong. The head waitress here is super nice and friendly. We'll...,2021-07-31 04:46:06
Applebee's Grill + Bar,aZ1U-AU3_J3aUC1tXkYoGQ,5,"If you are American, this place will disappoint because it is not the cheesy chain restaurant in the USA... it is a seafood restaurant with a bar... you can...",2021-10-18 14:43:46
Applebee's Grill + Bar,SRFbb5wYV2d7Zh1Oy4--Jw,4,"Applebee's Fish at the Borough Market is where we went for our Fish and Chips during our brief stop in London. It was a Saturday so crazy at the Market, but...",2023-02-18 15:43:52
Applebee's Grill + Bar,LTmPi4bnJGxUKvQFstYQlg,4,Having gone to London for decades we always stop at the market to see what is new. This time for lunch we stopped at Applebee's Fish for a change. It was...,2022-08-25 07:04:44
Gelateria 3bis,xbc-fmPSchoZWh5uL5R-4w,5,Really good gelato. Great service from the counter attendant who helped us select our flavors. We came back twice during our stay.,2022-12-17 09:47:56
Gelateria 3bis,Uyo9wpxZbf3JdHNRvnIBWg,4,I was in search of coffee as I needed a pick me up to get me through the rest of day.  I had initially bookmarked a popular coffee shop at the Borough...,2022-10-13 18:07:24
Gelateria 3bis,cL2NHU4DUhYm9oy5QVNECg,3,"Super sweet gelato, not the best around but good enough to tide you over if you are hankering for dessert.",2022-06-21 03:52:14
J Sheekey,AK2qG3SOWBrgjUGYsKi7sg,5,So fantastic in every way. The oysters were fantastic and they were expertly prepared and presented. Crab and avocado salad delicious. The caviar under the...,2022-09-26 08:14:06
J Sheekey,kvhA_Pto0iK9oVzTSNwujw,4,I do not know quite what to put on this review. I liked J. Sheekey OK but would I probably go again probably not. The food was good and the service was OK...,2022-11-07 17:21:00
J Sheekey,MK_Ly3HZlZgUy0Gq0uLWuw,4,"Came here with my coworker and we were not disappointed! The ambience is lovely, and the food is excellent as well. The scallops had this amazing sauce that...",2022-12-07 09:51:27
Kêu!,wVd0abuNPId_ip-o7C8_lw,5,"This place slaps.   Authentic, a good variety and fresh!!!  Small little shop in a great location.  We went here for a late lunch and was not disappointed....",2022-12-20 08:17:22
Kêu!,uuEdwd-ETkgaKpdPJ2naOA,4,I love Kêu and frequent both their SOHO and Shoreditch locations often. My favorite is the tofu banh mi. They offer at least two vegan banh mi options and...,2021-04-20 06:25:38
Kêu!,sDPoywuAgs6xgvX6xmqUvA,4,"If you're looking for an upscale street food place, look no further... this is it! Easily located and just five mins walk from Old Street Station. 

I...",2018-11-10 06:31:04
Amerigo Vespucci,BaDXki18eWb9naO9PdFkYQ,4,"This is a fun, lively restaurant serving Italian fare. The food was good but unfortunately the kitchen and waitstaff were clearly understaffed. Service was...",2019-09-13 01:43:01
Amerigo Vespucci,uXIzUezf89RMEhjkRTK81A,4,"Great choice and the pasta is nicely prepared. They seemed to be bread or olives for some tables but I don't think we ""rated"" but it was good nonetheless....",2021-12-01 06:51:19
Amerigo Vespucci,GtTOJ4jW1QU7YpPZ1Jkfzg,4,"Quite good classic Italian cuisine, well executed, and excellent service (a good sign: waitstaff were all Italians!).  It's location in Cabot Square of the...",2018-07-30 18:20:29
BunBunBun Vietnamese Food,SIgRXaLqK5O0gybVk8EzTw,5,"I'm upping my review from 1 Star to 5 stars. I do not know what has happened, but my dad was in town and I took him here, the food far out matches any other...",2018-02-06 05:36:54
BunBunBun Vietnamese Food,6itB35_uOMdczoS18wnzLQ,3,"I've ordered delivery from here before, and this was my first time being able to eat in the restaurant. The first good sign was the sriracha sitting on the...",2022-06-27 12:36:03
BunBunBun Vietnamese Food,5nl0NJQzYpur_dZ6gMyx-g,5,"Excellent, with plenty of vegetables and aromatic herbs in the Pho. From the reviews, the crowd and the dish I had, it seems like one of the best options...",2022-05-25 10:39:25
Hoxton Grill,HOaDmhsWPYutw-lLLAHFqQ,4,Stopped in for a few drinks after work- wow! The atmosphere is very nice even if the music is a little loud. The drinks are priced with what I would expect...,2022-11-10 08:51:26
